{
  "map": {
    "setting": "grass",

    "walls": [
      {
        "wall": {
          "x": 10,
          "y": 10,
          "height": 2,
          "width": 10
        }
      },

      {
        "wall": {
          "x": 20,
          "y": 10,
          "height": 10,
          "width": 2
        }
      },

      {
        "wall": {
          "x": 10,
          "y": 10,
          "width": 2,
          "height": 10
        }
      },

      {
        "wall": {
          "x": 10,
          "y": 20,
          "width": 5,
          "height": 2
        }
      },

      {
        "wall": {
          "x": 17,
          "y": 20,
          "width": 5,
          "height": 2
        }
      }
    ],

    "conditionals": [
      {
        "wall": {
          "x": 15,
          "y": 20,
          "width": 2,
          "height": 2
        }
      }
    ],

    "items": [
      {
        "item": {
          "x": 15,
          "y": 8,
          "type": "key"
        }
      }
    ],

    "containers": [
      {
        "container": {
          "x": 14,
          "y": 22,
          "type": "opening"
        }
      }
    ]
  },

  "enemies": [
    {
      "enemy": {
        "type": "pig",
        "x": 14,
        "y": 14
      }
    }
  ],

  "win": "kill",

  "bot": {
    "x": 5,
    "y": 16
  },

  "default": {
    "code": [
      "# Use the standard bot",
      "bot = __impl"
    ]
  },

  "messages": [
    {
      "message": [
        "One days food may not be enough",
        "Good there are more pigs here"
      ]
    },

    {
      "message": [
        "This one is fenced in",
        "You'll need to unlock the fence"
      ]
    },

    {
      "message": [
        "I'm not like that other bot",
        "I can think for myself"
      ]
    },

    {
      "message": [
        "I don't know the solutions",
        "This is my first time here too"
      ]
    }
  ]
}