{
  "map": {
    "setting": "future",

    "goal": {
      "x": 20,
      "y": 20
    }
  },

  "win": "goal",

  "bot": {
    "x": 2,
    "y": 2
  },

  "default": {
    "code": [
      "# Use a custom bot",
      "import bots.Basebot as __ibot",
      "class newbot(__ibot):",
      "  def __init__(self):",
      "    __ibot.__init__(self)",
      "  def move(self, x):",
      "    pass",
      "def move(bot, x):",
      "  __ibot.move(bot, x)"
    ]
  },

  "messages": [
    {
      "message": [
        "We're here"
      ]
    },

    {
      "message": [
        "Human, after everything we've",
        "gone through. I'd like to thank you"
      ]
    },

    {
      "message": [
        "Come, join me as I return to the automata",
        "to my people"
      ]
    }
  ]
}