{
  "map": {
    "setting": "future",

    "goal": {
      "x": 29,
      "y": 20
    }
  },

  "enemies": [
    {
      "enemy": {
        "type": "alien",
        "x": 7,
        "y": 31
      }
    },

    {
      "enemy": {
        "type": "tut0",
        "x": 29,
        "y": 20
      }
    }
  ],

  "win": "goal",

  "bot": {
    "x": 2,
    "y": 2
  },

  "default": {
    "code": [
      "# Use a custom bot",
      "import bots.Basebot as __ibot",
      "class newbot(__ibot):",
      "  def __init__(self):",
      "    __ibot.__init__(self)",
      "  def move(self, x):",
      "    pass",
      "def move(bot, x):",
      "  __ibot.move(bot, x)"
    ]
  },

  "messages": [
    {
      "message": [
        "..."
      ]
    }
  ]
}