{
  "map": {
    "setting": "future",

    "walls": [
      {
        "wall": {
          "x": 15,
          "y": 0,
          "width": 3,
          "height": 30
        }
      }
    ],

    "goal": {
      "x": 20,
      "y": 20
    }
  },

  "enemies": [
    {
      "enemy": {
        "type": "alien",
        "x": 8,
        "y": 33
      }
    }
  ],

  "win": "goal",

  "bot": {
    "x": 2,
    "y": 2
  },

  "default": {
    "code": [
      "# Use a custom bot",
      "import bots.Basebot as __ibot",
      "class newbot(__ibot):",
      "  def __init__(self):",
      "    __ibot.__init__(self)",
      "  def move(self, x):",
      "    pass",
      "def move(bot, x):",
      "  __ibot.move(bot, x)"
    ]
  },

  "messages": [
    {
      "message": [
        "Thank you..."
      ]
    },

    {
      "message": [
        "I don't know what happened there"
      ]
    },

    {
      "message": [
        "The ghosts of my people...",
        "...they haunt me"
      ]
    }
  ]
}