{
  "map": {
    "setting": "factory",

    "walls": [
      {
        "wall": {
          "x": 14,
          "y": 14,
          "height": 12,
          "width": 3
        }
      }
    ],

    "goal": {
      "x": 25,
      "y": 20
    }
  },

  "win": "goal",

  "bot": {
    "x": 5,
    "y": 20
  },

  "default": {
    "code": [
      "# Use a custom bot",
      "import bots.Basebot as __ibot",
      "class coolbot(__ibot):",
      "  def move(self, x):",
      "    __ibot.move(self, x + 2)",
      "bot = coolbot()"
    ]
  },

  "messages": [
    {
      "message": [
        "We had to move some items again",
        "Get the bot to the loading area"
      ]
    },

    {
      "message": [
        "There is different default code",
        "look at it under the default tab"
      ]
    },

    {
      "message": [
        "The bot moves now moves x + 2 tiles"
      ]
    }
  ]
}