{
  "map": {
    "setting": "grass",

    "walls": [
      {
        "wall": {
          "x": 15,
          "y": 14,
          "height": 2,
          "width": 11
        }
      },

      {
        "wall": {
          "x": 26,
          "y": 14,
          "height": 10,
          "width": 2
        }
      },

      {
        "wall": {
          "x": 15,
          "y": 14,
          "width": 2,
          "height": 10
        }
      },

      {
        "wall": {
          "x": 15,
          "y": 24,
          "width": 5,
          "height": 2
        }
      },

      {
        "wall": {
          "x": 23,
          "y": 24,
          "width": 5,
          "height": 2
        }
      },

      {
        "wall": {
          "x": 15,
          "y": 39,
          "height": 2,
          "width": 11
        }
      },

      {
        "wall": {
          "x": 26,
          "y": 31,
          "height": 10,
          "width": 2
        }
      },

      {
        "wall": {
          "x": 15,
          "y": 31,
          "width": 2,
          "height": 10
        }
      },

      {
        "wall": {
          "x": 15,
          "y": 29,
          "width": 5,
          "height": 2
        }
      },

      {
        "wall": {
          "x": 23,
          "y": 29,
          "width": 5,
          "height": 2
        }
      }
    ],

    "conditionals": [
      {
        "wall": {
          "x": 20,
          "y": 24,
          "width": 3,
          "height": 2
        }
      },

      {
        "wall": {
          "x": 20,
          "y": 29,
          "width": 3,
          "height": 2
        }
      }
    ],

    "items": [
      {
        "item": {
          "x": 15,
          "y": 8,
          "type": "key"
        }
      }
    ],

    "containers": [
      {
        "container": {
          "x": 21,
          "y": 27,
          "type": "opening"
        }
      }
    ]
  },

  "enemies": [
    {
      "enemy": {
        "type": "pig",
        "x": 19,
        "y": 18
      }
    },

    {
      "enemy": {
        "type": "pig",
        "x": 20,
        "y": 18
      }
    },

    {
      "enemy": {
        "type": "pig",
        "x": 20,
        "y": 37
      }
    },

    {
      "enemy": {
        "type": "pig",
        "x": 19,
        "y": 37
      }
    },

    {
      "enemy": {
        "type": "pig",
        "x": 19,
        "y": 36
      }
    },

    {
      "enemy": {
        "type": "pig",
        "x": 19,
        "y": 19
      }
    }
  ],

  "win": "kill",

  "bot": {
    "x": 5,
    "y": 16
  },

  "default": {
    "code": [
      "# Use a damaged bot",
      "import bots.Basebot as __ibot",
      "class broken(__ibot):",
      "  def move(self, x):",
      "    self.right(10)",
      "    __ibot.move(self, x + 3)",
      "    self.left(10)",
      "  def right(self, degrees):",
      "    __ibot.right(self, degrees * 2)",
      "  def left(self, degrees):",
      "    __ibot.left(self, degrees * 2)",
      "bot = broken()"
    ]
  },

  "messages": [
    {
      "message": [
        "I'm getting more error reports",
        "Hope you're okay there"
      ]
    },

    {
      "message": [
        "Oh! I see how many pigs are there!",
        "That should do us for a while"
      ]
    },

    {
      "message": [
        "I feel sad",
        "This place kinda reminded me of home"
      ]
    }
  ]
}