{
  "map": {
    "setting": "grass",

    "walls": [
      {
        "wall": {
          "x": 15,
          "y": 14,
          "height": 2,
          "width": 10
        }
      },

      {
        "wall": {
          "x": 25,
          "y": 14,
          "height": 10,
          "width": 2
        }
      },

      {
        "wall": {
          "x": 15,
          "y": 14,
          "width": 2,
          "height": 10
        }
      },

      {
        "wall": {
          "x": 15,
          "y": 24,
          "width": 5,
          "height": 2
        }
      },

      {
        "wall": {
          "x": 22,
          "y": 24,
          "width": 5,
          "height": 2
        }
      }
    ],

    "conditionals": [
      {
        "wall": {
          "x": 20,
          "y": 24,
          "width": 2,
          "height": 2
        }
      }
    ],

    "items": [
      {
        "item": {
          "x": 15,
          "y": 8,
          "type": "key"
        }
      }
    ],

    "containers": [
      {
        "container": {
          "x": 19,
          "y": 26,
          "type": "opening"
        }
      }
    ]
  },

  "enemies": [
    {
      "enemy": {
        "type": "pig",
        "x": 19,
        "y": 18
      }
    },

    {
      "enemy": {
        "type": "pig",
        "x": 20,
        "y": 18
      }
    },

    {
      "enemy": {
        "type": "pig",
        "x": 19,
        "y": 19
      }
    }
  ],

  "win": "kill",

  "bot": {
    "x": 5,
    "y": 16
  },

  "default": {
    "code": [
      "# Use a damaged bot",
      "import bots.Basebot as __ibot",
      "class broken(__ibot):",
      "  def move(self, x):",
      "    self.right(10)",
      "    __ibot.move(self, x + 3)",
      "bot = broken()"
    ]
  },

  "messages": [
    {
      "message": [
        "Hmm...",
        "Seems the bot has developed an error"
      ]
    },

    {
      "message": [
        "We'll have to go with it for now",
        "I'll try to fix it later on"
      ]
    },

    {
      "message": [
        "These humans...",
        "Thinking we are just machines"
      ]
    }
  ]
}