{
  "map": {
    "setting": "factory",

    "goal": {
      "x": 25,
      "y": 25
    }
  },

  "win": "goal",

  "bot": {
    "x": 5,
    "y": 20
  },

  "default": {
    "code": [
      "# Use the standard bot",
      "bot = __impl"
    ]
  },

  "messages": [
    {
      "message": [
        "Move the bot to the loading area",
        "Click on me if you need help"
      ]
    },

    {
      "message": [
        "Bots can change direction with",
        "bot.left(degrees) or bot.right(degrees)"
      ]
    },

    {
      "message": [
        "The bot will turn left or right",
        "from its facing direction by that many degrees"
      ]
    },

    {
      "message": [
        "After turing the bot can move again"
      ]
    }
  ]
}