{
  "map": {
    "setting": "factory",

    "walls": [
      {
        "wall": {
          "x": 14,
          "y": 14,
          "height": 12,
          "width": 3
        }
      }
    ],

    "items": [
      {
        "item": {
          "x": 15,
          "y": 12,
          "type": "key"
        }
      }
    ],

    "goal": {
      "x": 25,
      "y": 20
    }
  },

  "win": "time",

  "bot": {
    "x": 5,
    "y": 20
  },

  "default": {
    "code": [
      "# Use standard bot",
      "bot = __impl"
    ]
  },

  "messages": [
    {
      "message": [
        "What was that?"
      ]
    },

    {
      "message": [
        "Get to the goal with the key"
      ]
    }
  ]
}