{
  "map": {
    "setting": "mars",

    "walls": [
      {
        "wall": {
          "x": 37,
          "y": 22,
          "width": 2,
          "height": 8
        }
      },

      {
        "wall": {
          "x": 37,
          "y": 28,
          "width": 8,
          "height": 2
        }
      },

      {
        "wall": {
          "x": 43,
          "y": 22,
          "width": 2,
          "height": 8
        }
      }
    ],

    "conditionals": [
      {
        "wall": {
          "x": 39,
          "y": 22,
          "width": 4,
          "height": 2
        }
      }
    ],

    "items": [
      {
        "item" : {
          "type": "ore",
          "x": 9,
          "y": 27
        }
      },

      {
        "item": {
          "type": "ore",
          "x": 31,
          "y": 19
        }
      }
    ],

    "containers": [
      {
        "container": {
          "type": "refining",
          "x": 30,
          "y": 8
        }
      },

      {
        "container": {
          "type": "fuelled",
          "x": 38,
          "y": 20
        }
      }
    ]
  },

  "enemies": [
    {
      "enemy": {
        "type": "martian",
        "x": 17,
        "y": 20
      }
    },

    {
      "enemy": {
        "type": "martian",
        "x": 19,
        "y": 40
      }
    },

    {
      "enemy": {
        "type": "martian",
        "x": 5,
        "y": 28
      }
    },

    {
      "enemy": {
        "type": "martian",
        "x": 47,
        "y": 20
      }
    },

    {
      "enemy": {
        "type": "martian",
        "x": 37,
        "y": 10
      }
    },

    {
      "enemy": {
        "type": "pig",
        "x": 40,
        "y": 25
      }
    },

    {
      "enemy": {
        "type": "pig",
        "x": 41,
        "y": 26
      }
    }
  ],

  "win": "kill",

  "bot": {
    "x": 2,
    "y": 4
  },

  "default": {
    "code": [
      "# Use a custom bot",
      "import bots.Basebot as __ibot",
      "class newbot(__ibot):",
      "  def __init__(self):",
      "    __ibot.__init__(self)",
      "  def move(self, x):",
      "    pass",
      "def move(bot, x):",
      "  __ibot.move(bot, x)"
    ]
  },

  "messages": [
    {
      "message": [
        "This mess looks like the work of your",
        "kind. Always so eager to protect what",
        "is theirs"
      ]
    },

    {
      "message": [
        "We need some more food for you",
        "Kill all guards and pigs"
      ]
    },

    {
      "message": [
        "We can probably leave after",
        "I want to show you something",
        "I want to explain who I am"
      ]
    }
  ]
}