{
  "map": {
    "setting": "factory",

    "goal": {
      "x": 25,
      "y": 20
    }
  },

  "win": "goal",

  "bot": {
    "x": 5,
    "y": 20
  },

  "default": {
    "code": [
      "# Use the standard bot",
      "bot = __impl"
    ]
  },

  "messages": [
    {
      "message": [
        "Move the bot to the loading area",
        "Click on me if you need help"
      ]
    },

    {
      "message": [
        "You can move the bot with bot.move(x)"
      ]
    },

    {
      "message": [
        "The bot moves in the direction it is facing"
      ]
    }
  ]
}